city,city_cn,province,lon,lat,region_note
Wuhan,武汉,Hubei,114.3054,30.5928,Middle Yangtze core city
Yichang,宜昌,Hubei,111.2864,30.6919,Downstream of Three Gorges Reservoir region
Jingzhou,荆州,Hubei,112.2397,30.3352,Jianghan Plain and Yangtze River bank city
Changsha,长沙,Hunan,112.9388,28.2282,Xiangjiang River basin representative city
Yueyang,岳阳,Hunan,113.1289,29.3571,Dongting Lake region representative city
Nanchang,南昌,Jiangxi,115.8582,28.6820,Poyang Lake plain representative city
Jiujiang,九江,Jiangxi,115.9928,29.7120,Yangtze River and Poyang Lake junction city
